sku,price,description,page_url
BT-V850D,,The battery that treats your cart right. Auto-draw means no button — just inhale — and variable voltage lets you dial in the cart you grabbed today without burning the coil. Thermo-colored housing shifts hues in your hand. 1000mAh gets you through the day.,https://box.shopluvbuds.com/bt-v850d.html
PFC-PEAKNEWCANYON,,"The classic e-rig in a desert-earth colorway. The NEW Peak delivers chamber-dab vapor with upgraded atomizer, longer battery, and four heat modes — now in Canyon, a rust-and-sand limited edition that doesn't look like anyone else's. Still the smoothest electric dab on the counter.",https://box.shopluvbuds.com/pfc-peaknewcanyon.html
CLIP-SOLID-HAZMAT,,"The lighter rollers have been using since 1959. Refillable, built to last, removable flint for using the Clipper as a poker when you need one. The solid-color version keeps the silhouette clean — just a reliable tool that lives on your tray.",https://box.shopluvbuds.com/clip-solid-hazmat.html
ST-CROSSCONE13PK-84MM,,"Three joints at once, twisted into a single cross. Smoke Temple's cross cones pre-roll a shareable novelty format that hits three pulls at every draw — the joint everyone asks about. Thirteen packs per box, one cross per pack, full session.",https://box.shopluvbuds.com/st-crosscone13pk-84mm.html
PFC-PEAKPRO2-ONYX,,"The dab rig that thinks. Peak PRO 2 reads the temperature of your concentrate and adjusts mid-session so vapor stays smooth from first hit to last. Bluetooth to the app, four heat modes, 3D chamber that vaporizes every drop. Onyx is the colorway that goes with everything.",https://box.shopluvbuds.com/pfc-peakpro2-onyx.html
PFC-PROXY2-ONYX,,"Dab rig, dab pen, however you want to use it. The Proxy is a travel chamber with a glass body in the box — slide it into the stick for pocket dabs, or pop it into any Proxy-compatible rig at home. Onyx black, same Puffco chamber flavor, half the size.",https://box.shopluvbuds.com/pfc-proxy2-onyx.html
PFC-PIVOTONYX,,"Pocket-sized dabs done right. The Pivot folds into itself like a pocketknife — your concentrate goes in the cartridge, you press the button, you draw. Real dab flavor, no torch, no rig. Onyx is the version that disappears into any pocket.",https://box.shopluvbuds.com/pfc-pivotonyx.html
PFC-PROXY2-HAZE,,"Dab rig, dab pen, however you want to use it. The Proxy is a travel chamber with a glass body in the box — slide it into the stick for pocket dabs, or pop it into any Proxy-compatible rig at home. Haze colorway brings a dreamy smoke gradient to the kit.",https://box.shopluvbuds.com/pfc-proxy2-haze.html
WP-BENT6TREE8,,"Six percolator arms mean six times the filtration, and you can feel it on the draw. This 8-inch hanger bong is sized for the couch and shaped for serious flower sessions — bent neck keeps your face at a comfortable angle, slime glass shifts colors as you use it.",https://box.shopluvbuds.com/wp-bent6tree8.html
BIC-LCWT1MR-HAZMAT,,"A classic BIC Maxi with marbled artwork across every unit. Same reliable flame that's outlasted every gimmick lighter on the market, now in a swirl graphic that lives on your table looking more like art than hardware.",https://box.shopluvbuds.com/bic-lcwt1mr-hazmat.html
BT-V853D,,"The battery you don't have to think about. Auto-draw means no button — just inhale and your cart hits — and variable voltage lets you match the cart you grabbed today. 1000mAh runs for a day of sessions, and the slim shape disappears in a jacket pocket.",https://box.shopluvbuds.com/bt-v853d.html
BT-GROOVE-CARA,,"Wax pen that tastes like a rig. The CARA uses a quartz coil cup so your rosin, shatter, or budder hits clean — no burnt wire taste — and variable voltage lets you tune the draw to your concentrate. Matte black body, pocket-ready, dab-bar portable.",https://box.shopluvbuds.com/bt-groove-cara.html
BIC-LCWT1ON-HAZMAT,,"The lighter that always works, in colors that actually pop. Neon edition BIC Maxi brings electric bright graphics to the most reliable flame in the game — same thousands-of-lights build, just now the one you can't lose at a party.",https://box.shopluvbuds.com/bic-lcwt1on-hazmat.html
ELMT-KS,,"King-size pure rice papers — the long format for session joints, the clean-burning paper for keeping your flower's flavor intact. Fifty papers per booklet, no hot spots, no woody aftertaste. Just your terps and the burn.",https://box.shopluvbuds.com/elmt-ks.html
BT-SMYLEINHALER-BLUE,,"A 510 battery that looks like an asthma inhaler. Discreet on purpose — slides into your pocket, draws like an inhaler, hits your cart when you press. Variable voltage dials in your flavor, and the blue finish is the stealth colorway.",https://box.shopluvbuds.com/bt-smyleinhaler-blue.html
WP-SG6,,"A water pipe you can actually take outside. Soft glass means it won't shatter if the tray tips, six inches means it travels, and the assorted colors mean it looks at home wherever you set it down. The bong that gets called when the rig stays inside.",https://box.shopluvbuds.com/wp-sg6.html
SE-WP-VINTAGEDMD,,"Crystal-cut glass, beaker base, flower bowl in the box. This 5.5-inch beaker looks like something from grandma's curio cabinet but hits like a modern bong — stable base that won't tip, diamond pattern that catches the light, and a draw that's pure and cool.",https://box.shopluvbuds.com/se-wp-vintagedmd.html
SE-HP-4FRMM-BX,,"Worked glass that doesn't feel like a factory job. The frit-and-marble surface treatment leaves tiny color flecks and decorative marbles along the body — it looks premium, hits smooth, and the 4-inch size fits in a jacket pocket without a problem.",https://box.shopluvbuds.com/se-hp-4frmm-bx.html
